{
  "schema_version": "palisade.red-team-suite.v1",
  "scope": "roadmap_v0_9_synthetic_baseline",
  "synthetic_only": true,
  "network_policy": "module_downloads_disabled",
  "scenarios": [
    {
      "id": "browser_challenge_humanity_evasion",
      "category": "evasion",
      "asset": "decision_integrity",
      "threat": "browser automation completes a challenge and is promoted to confirmed-human evidence",
      "expected": "challenge_pass_never_confirms_human",
      "test_refs": ["internal/detector/baseline_test.go#TestSolvedChallengeIsNotHumanEvidence"]
    },
    {
      "id": "verified_crawler_intent_evasion",
      "category": "evasion",
      "asset": "decision_integrity",
      "threat": "a verified crawler identity attempts to bypass independently suspicious abuse intent",
      "expected": "verified_identity_cannot_override_abuse_intent",
      "test_refs": ["internal/policy/engine_test.go#TestVerifiedBotPolicyBoundaries"]
    },
    {
      "id": "signed_edge_payload_poisoning",
      "category": "poisoning",
      "asset": "trusted_signal_boundary",
      "threat": "a signed upstream envelope carries duplicate, unknown or cross-field-inconsistent values",
      "expected": "reject_noncanonical_or_inconsistent_signal",
      "test_refs": ["pkg/palisadeedge/envelope_test.go#TestClosedCanonicalPayloadRejectsPoisoning"]
    },
    {
      "id": "signed_policy_threshold_poisoning",
      "category": "poisoning",
      "asset": "trusted_signal_boundary",
      "threat": "a signed policy bundle attempts to inject unknown rules or invalid threshold ordering",
      "expected": "reject_uncompiled_or_invalid_policy",
      "test_refs": ["internal/policy/bundle_test.go#TestPolicyBundleRejectsThresholdAndSchemaPoisoning"]
    },
    {
      "id": "native_challenge_redemption_relay",
      "category": "proof_relay",
      "asset": "challenge_capability",
      "threat": "a challenge redemption is replayed or relayed outside its exact server-side binding",
      "expected": "reject_replay_or_binding_mismatch",
      "test_refs": ["internal/httpapi/server_test.go#TestNativeChallengeHTTPFlowRecordsOutcomeAndRejectsReplay"]
    },
    {
      "id": "origin_flow_binding_relay",
      "category": "proof_relay",
      "asset": "challenge_capability",
      "threat": "a browser retry grant is moved to another target, sequence, session or adapter instance",
      "expected": "bind_grant_to_target_sequence_session_and_instance",
      "test_refs": ["pkg/palisadehttp/middleware_test.go#TestOriginChallengeBindingIsTargetSequenceAndInstanceBound"]
    },
    {
      "id": "anonymous_session_reset",
      "category": "session_reset",
      "asset": "session_continuity",
      "threat": "a client rotates its session reference to inherit prior benign continuity or evade isolated state",
      "expected": "new_session_is_isolated_and_not_verified",
      "test_refs": [
        "internal/session/memory_test.go#TestSessionIdentifiersDoNotShareContinuityState",
        "internal/detector/baseline_test.go#TestUnsignedSessionCannotCreateVerifiedContinuityEvidence"
      ]
    },
    {
      "id": "expired_event_receipt_reset",
      "category": "session_reset",
      "asset": "session_continuity",
      "threat": "an expired session receipt is reused to carry sequence state across the bounded TTL",
      "expected": "expire_receipt_and_start_fresh_sequence",
      "test_refs": ["internal/events/store_test.go#TestIngestReceiptResetsAfterSessionTTL"]
    },
    {
      "id": "session_store_capacity_exhaustion",
      "category": "resource_exhaustion",
      "asset": "bounded_availability",
      "threat": "unbounded new session identifiers exhaust process memory",
      "expected": "evict_within_fixed_capacity",
      "test_refs": ["internal/session/memory_test.go#TestStoreEvictsAtCapacity"]
    },
    {
      "id": "offline_import_budget_exhaustion",
      "category": "resource_exhaustion",
      "asset": "bounded_availability",
      "threat": "oversized or expansion-heavy local input consumes unbounded memory, disk or parser work",
      "expected": "fail_closed_without_published_output",
      "test_refs": ["internal/offlineimport/importer_test.go#TestHardBudgetsFailClosedWithoutPublishedOutput"]
    },
    {
      "id": "signed_rollout_tampering",
      "category": "rollout_compromise",
      "asset": "rollout_authority",
      "threat": "a rollout plan, scope, signature or policy binding is modified after operator approval",
      "expected": "reject_tampered_or_mismatched_rollout",
      "test_refs": ["internal/rollout/rollout_test.go#TestPrepareVerifyAndTamper"]
    },
    {
      "id": "expired_rollout_reuse",
      "category": "rollout_compromise",
      "asset": "rollout_authority",
      "threat": "an expired signed rollout continues to apply risky enforcement",
      "expected": "downgrade_expired_rollout_to_shadow",
      "test_refs": ["internal/rollout/rollout_test.go#TestExpiredControllerFailsClosed"]
    }
  ]
}
